{
  "execution_id": "plan_fitness_price_increase_10pct_v1",
  "created_at": "2026-03-17T13:50:33.607823+00:00",
  "source_instruction": "Increase prices by 10% for all in-stock fitness products.",
  "operations": [
    {
      "operation_id": "op_fitness_price_increase",
      "description": "Increase prices by 10% for all in-stock fitness products.",
      "filter": {
        "categories": [
          "fitness"
        ],
        "in_stock": true
      },
      "action": {
        "type": "percent_increase",
        "value": 10.0
      },
      "options": {
        "round_to": 2
      }
    }
  ],
  "summary_prompt": "List each SKU that was changed with its old and new value. State the total number of products affected and which products were skipped and why."
}